competency_id,batch_id,title,description,related_skills,related_skills_with_bloom,skill_focus,future_relevance,all_skills_human_verified,human_quality,human_relevant,human_skill_focus,human_notes,reviewer_id
C1_b61,61,Optimize Data for Consumption and Performance,Evaluate and optimize data for consumption by establishing performance metrics and configuring network solutions to ensure efficient and high-quality service delivery.,"[""optimize data for consumption"", ""establish performance metrics"", ""configure network solutions"", ""configured"", ""deliver services""]",optimize data for consumption (Bloom: Evaluate); establish performance metrics (Bloom: nan); configure network solutions (Bloom: Apply); configured (Bloom: Apply); deliver services (Bloom: nan),Both,"As data volumes grow, the ability to efficiently process and deliver data is crucial for real-time analytics, AI applications, and scalable cloud services. This competency ensures data infrastructure can meet future demands.",,,,,,
C2_b62,62,Real-time System Implementation and Process Optimization,"Apply real-time implementation strategies and evaluate existing processes to optimize operational efficiency, such as managing procurement and supporting month-end close processes.","[""implementation of real -time"", ""work with IBM Sterling"", ""Manage procurement"", ""support month-end close process"", ""collect supplier performance data""]",implementation of real -time (Bloom: Apply); work with IBM Sterling (Bloom: Apply); Manage procurement (Bloom: Apply); support month-end close process (Bloom: Evaluate); collect supplier performance data (Bloom: Apply),Hard,The demand for immediate data processing and automated workflows is growing across industries. This competency is crucial for developing and maintaining responsive systems that enhance business agility and decision-making.,,,,,,
C1_b63,63,Optimize Full-Stack Development and Performance,"Apply full-stack development principles to contribute across all layers of a software application, pushing the boundaries of optimization to enhance performance and efficiency.","[""contribute across the full stack"", ""push boundaries of optimisation"", ""use Next.js""]",contribute across the full stack (Bloom: Apply); push boundaries of optimisation (Bloom: Apply); use Next.js (Bloom: Apply),Hard,"Full-stack development remains crucial for agile and efficient software delivery. Optimization skills are increasingly vital as applications become more complex and resource-intensive, especially with the rise of AI-driven services.",,,,,,
C3_b64,64,Analyze and Resolve System Defects,Analyze and resolve system defects by leading root cause analysis and utilizing trouble ticketing systems to ensure system stability and performance.,"[""use trouble ticketing systems"", ""lead defect root cause analysis""]",use trouble ticketing systems (Bloom: Apply); lead defect root cause analysis (Bloom: Analyze),Hard,"With the increasing complexity of software systems, the ability to efficiently diagnose and resolve issues is critical for maintaining operational integrity and supporting advanced technologies like AI and cloud infrastructure.",,,,,,
C2_b65,65,Lead and Influence Organizational Change and Strategy,"Lead and influence organizational change and strategy by setting clear roadmaps, guiding transformation initiatives, contributing to business strategy, and presenting a compelling vision to stakeholders.","[""set clear roadmaps"", ""guide transformation"", ""contribute to business strategy"", ""present vision"", ""catalyst change""]",set clear roadmaps (Bloom: nan); guide transformation (Bloom: nan); contribute to business strategy (Bloom: nan); present vision (Bloom: nan); catalyst change (Bloom: nan),Soft,"In a rapidly evolving technological landscape, professionals who can effectively drive strategic change and articulate a clear vision are essential for organizations to adapt and thrive.",,,,,,
C1_b66,66,Strategic Planning and Project Delivery,"Create master plans and define strategies for project execution, ensuring alignment with organizational objectives and budgetary constraints to drive successful delivery.","[""create master plans"", ""drive delivery"", ""define strategy for Python driver"", ""define the strategy"", ""ensure projects are delivered in accordance with budgetary objectives"", ""align with strategic objectives""]",create master plans (Bloom: Create); drive delivery (Bloom: nan); define strategy for Python driver (Bloom: Evaluate); define the strategy (Bloom: Evaluate); ensure projects are delivered in accordance with budgetary objectives (Bloom: nan); align with strategic objectives (Bloom: nan),Both,The ability to strategically plan and execute projects efficiently is crucial for navigating complex technological landscapes and achieving business goals in an evolving market.,,,,,,
C2_b67,67,Manage Customer Experience and Stakeholder Communication,"Drive customer experience strategy and resolve escalations by effectively liaising with internal and external stakeholders, ensuring clear communication and support.","[""drive customer experience strategy"", ""inform campaigns"", ""send portfolio"", ""push for clarity"", ""resolve escalations"", ""support external customers"", ""liaise with Finance""]",drive customer experience strategy (Bloom: nan); inform campaigns (Bloom: nan); send portfolio (Bloom: nan); push for clarity (Bloom: nan); resolve escalations (Bloom: nan); support external customers (Bloom: nan); liaise with Finance (Bloom: nan),Soft,"As customer expectations evolve and digital interactions become more prevalent, managing customer experience and stakeholder communication effectively is paramount for business success and brand reputation. This competency is vital for navigating complex service environments.",,,,,,
C3_b68,68,Manage and Optimize Business Operations,"Coordinate and execute operational tasks, including managing vehicle delivery and assisting with month-end closings, to ensure efficient business processes and financial control.","[""manage vehicle delivery"", ""assist with month-end closings"", ""ensure financial control"", ""coordinate operations"", ""executing""]",manage vehicle delivery (Bloom: nan); assist with month-end closings (Bloom: Apply); ensure financial control (Bloom: nan); coordinate operations (Bloom: nan); executing (Bloom: Apply),Both,Operational efficiency and financial oversight remain foundational for business sustainability. Automation and data-driven insights will further enhance these capabilities in the future.,,,,,,
C3_b69,69,Develop and Integrate AI-Enhanced Functionality,"Expand and integrate AI-enhanced functions into existing systems, leveraging AI technologies to improve system capabilities and manage complex tasks effectively.","[""expand functions"", ""juggle multiple""]",expand functions (Bloom: nan); juggle multiple (Bloom: Apply),Both,"As AI becomes ubiquitous, the skill to integrate and manage AI functionalities will be essential for developing intelligent systems and optimizing operational efficiency across industries.",,,,,,
C9_b70,70,Act as a Collaborative and Talented Professional,"Act as a talented and generous professional, fostering collaboration and contributing positively to team dynamics.","[""Act as"", ""talented"", ""be generous""]",Act as (Bloom: Apply); talented (Bloom: Apply); be generous (Bloom: nan),Both,"Soft skills like collaboration, generosity, and professionalism are increasingly valued in an era of human-AI collaboration, where interpersonal dynamics and ethical considerations are paramount.",,,,,,
C8_b71,71,Manage and Represent Organizational Reputation,Build and maintain a strong organizational reputation by representing the entity in external communities and fostering strong external relationships.,"[""maintain strong external relationships"", ""build reputation"", ""represent Dropbox in external communities""]",maintain strong external relationships (Bloom: nan); build reputation (Bloom: nan); represent Dropbox in external communities (Bloom: nan),Soft,"In an increasingly transparent and interconnected world, managing and representing an organization's reputation effectively is paramount for brand trust, talent acquisition, and business partnerships. This skill is vital for sustained organizational success.",,,,,,
C2_b72,72,Demonstrate Professional Judgement and Adaptability,Demonstrate professional judgement and adaptability by applying editorial judgement and adjusting focus in dynamic work environments to achieve desired outcomes.,"[""apply editorial judgement"", ""judgement"", ""adjust focus"", ""move fast""]",apply editorial judgement (Bloom: nan); judgement (Bloom: Evaluate); adjust focus (Bloom: Apply); move fast (Bloom: nan),Both,"The ability to exercise sound judgement and adapt quickly to changing circumstances is increasingly vital in fast-paced, technology-driven industries, where continuous learning and decision-making are paramount.",,,,,,
C2_b79,79,Analyze and Troubleshoot System Incidents,Analyze system incidents and ensure high-quality operational performance by troubleshooting issues using log analysis and identifying the root cause of problems.,"[""identify the “why”."", ""troubleshoot incidents using log analysis"", ""ensure high -quality"", ""ensure equipment is functioning at optimal level""]",identify the “why”. (Bloom: Analyze); troubleshoot incidents using log analysis (Bloom: Analyze); ensure high -quality (Bloom: Analyze); ensure equipment is functioning at optimal level (Bloom: Analyze),Hard,"As systems become more complex and interconnected, the ability to quickly and accurately diagnose issues through analytical methods like log analysis will be crucial for maintaining system reliability and minimizing downtime.",,,,,,
C2_b82,82,Integrate and Utilize RESTful APIs,"Apply knowledge of RESTful APIs to effectively integrate and utilize them within software applications, ensuring seamless communication between different services.","[""use RESTful APIs"", ""work with RESTful APIs""]",use RESTful APIs (Bloom: Apply); work with RESTful APIs (Bloom: Apply),Hard,"API-driven development is fundamental to modern software architectures, enabling microservices, cloud integrations, and interoperability. Proficiency in RESTful APIs is a foundational skill for future developers.",,,,,,
C2_b84,84,Operational Efficiency and Process Improvement,"Create and automate processes, such as renewals and inventory management, to improve productivity and management reporting, while adapting to product updates and responding to changes in priorities.","[""maintain inventory information"", ""adapt content based on product updates"", ""automate renewals"", ""make tooling seamless"", ""improve management reporting production"", ""improve productivity"", ""respond to changes in priorities""]",maintain inventory information (Bloom: Create); adapt content based on product updates (Bloom: nan); automate renewals (Bloom: Create); make tooling seamless (Bloom: nan); improve management reporting production (Bloom: nan); improve productivity (Bloom: nan); respond to changes in priorities (Bloom: nan),Both,"Optimizing operational workflows and automating repetitive tasks are essential for businesses to scale and remain competitive, especially with the increasing integration of AI and data-driven decision-making.",,,,,,
C2_b85,85,Develop Automated Testing Solutions,Create automated tests to ensure high-quality software delivery and adherence to customer specifications.,"[""build automated tests"", ""ensuring high -quality"", ""ensure team member adherence to customer specifications""]",build automated tests (Bloom: Create); ensuring high -quality (Bloom: Apply); ensure team member adherence to customer specifications (Bloom: nan),Both,"Automated testing is crucial for accelerating development cycles, maintaining code quality, and enabling continuous integration/continuous delivery (CI/CD) pipelines, which are increasingly vital in modern software development.",,,,,,
C2_b88,88,Manage and Resolve Technical Issues,Analyze and resolve complex technical problems by identifying mitigation options and managing changes to deliver high-quality milestones.,"[""resolve problems"", ""identify options for mitigation"", ""manage change"", ""deliver high quality milestones"", ""handle complex projects competently""]",resolve problems (Bloom: nan); identify options for mitigation (Bloom: Analyze); manage change (Bloom: nan); deliver high quality milestones (Bloom: nan); handle complex projects competently (Bloom: nan),Both,"Problem-solving and incident management are evergreen skills. As technology evolves, the nature of problems changes, but the fundamental ability to diagnose, mitigate, and resolve issues remains critical for all technical roles.",,,,,,
C1_b89,89,Software Development Process Optimization,"Optimize software development processes by analyzing existing workflows, identifying inefficiencies, and implementing automation and best practices to enhance reliability and execution efficiency.","[""ensure applications meet high standards of reliability"", ""prepare a plan to drive day-to-day execution of the project"", ""innovate solutions"", ""build improvement initiatives"", ""ensure best practices"", ""automate policy changes"", ""optimize development processes""]",ensure applications meet high standards of reliability (Bloom: Analyze); prepare a plan to drive day-to-day execution of the project (Bloom: Create); innovate solutions (Bloom: nan); build improvement initiatives (Bloom: nan); ensure best practices (Bloom: Analyze); automate policy changes (Bloom: Create); optimize development processes (Bloom: Create),Both,"While some individual skills in this area are declining, the overarching ability to optimize development processes remains crucial for efficiency and competitiveness in a rapidly evolving technological landscape. Automation and continuous improvement are key to future software delivery.",,,,,,
C1_b90,90,Software Debugging and Quality Assurance,"Analyze and debug front-end applications by utilizing internal defect tracking tools to create detailed, high-quality error reports and reviewing code to ensure successful design of system components.","[""utilize internal defect tracking tool to create detailed, high quality error report"", ""debug front-end applications"", ""ensure successful design of system components"", ""review code""]","utilize internal defect tracking tool to create detailed, high quality error report (Bloom: Create); debug front-end applications (Bloom: Analyze); ensure successful design of system components (Bloom: Create); review code (Bloom: Evaluate)",Hard,"While these skills are foundational, the future emphasizes automated debugging and AI-assisted quality assurance. Proficiency in manual debugging remains crucial for understanding complex system behaviors.",,,,,,
C2_b95,95,Architect Scalable Software Solutions,Architect scalable software systems by designing robust structures that can accommodate growth and changing demands.,"[""Architect scalable""]",Architect scalable (Bloom: Create),Hard,"Scalability is a critical concern for modern software, especially with the increasing adoption of cloud-native architectures and distributed systems. This competency ensures systems can handle future loads.",,,,,,
C1_b98,98,Maintain and Troubleshoot Software Systems,"Analyze and implement corrective measures for software systems by identifying issues, applying fixes, and ensuring adherence to coding standards and service level agreements.","[""corrective measures."", ""maintain technical documentation"", ""maintaining it"", ""perform regular maintenance tasks on building AV equipment"", ""coding"", ""write system development code"", ""ensure adherence to coding standards"", ""support ongoing maintenance of Epic Ambulatory build"", ""ensure compliance with SLAs"", ""implement fixes""]",corrective measures. (Bloom: Evaluate); maintain technical documentation (Bloom: Analyze); maintaining it (Bloom: Analyze); perform regular maintenance tasks on building AV equipment (Bloom: Create); coding (Bloom: Apply); write system development code (Bloom: Create); ensure adherence to coding standards (Bloom: Analyze); support ongoing maintenance of Epic Ambulatory build (Bloom: Create); ensure compliance with SLAs (Bloom: Analyze); implement fixes (Bloom: Apply),Hard,"While routine maintenance tasks may see some automation, the ability to analyze and troubleshoot complex software issues remains crucial for system stability and performance, especially as systems become more interconnected.",,,,,,
C1_b102,102,Develop and Maintain Web Applications,"Create functional and user-friendly web applications by designing front-end components and developing backend systems, ensuring ongoing maintenance and performance.","[""architect web applications"", ""build simple applications"", ""design front-end components"", ""develop backend"", ""develop front end systems"", ""engineer modern frontends"", ""high -impact web experiences"", ""maintain high-performing websites"", ""maintainable code"", ""ongoing maintenance"", ""perform hands-on development""]",architect web applications (Bloom: Create); build simple applications (Bloom: Create); design front-end components (Bloom: Create); develop backend (Bloom: Create); develop front end systems (Bloom: Create); engineer modern frontends (Bloom: Create); high -impact web experiences (Bloom: Apply); maintain high-performing websites (Bloom: Analyze); maintainable code (Bloom: Analyze); ongoing maintenance (Bloom: Apply); perform hands-on development (Bloom: Create),Hard,"While some specific technologies may decline, the core ability to develop and maintain web applications remains fundamental for digital product creation and business operations. Focus on modern frameworks and scalable architectures will be key.",,,,,,
C2_b105,105,Manage and Automate Data Operations,"Automate accounting and manage various data operations, including creating datasets, maintaining HR data, and working with complex financial and ERP datasets, to ensure accuracy and efficiency.","[""create a dataset."", ""automate accounting"", ""work with complex financial datasets"", ""maintain HR data"", ""data"", ""work with ERP datasets""]",create a dataset. (Bloom: Create); automate accounting (Bloom: Create); work with complex financial datasets (Bloom: Apply); maintain HR data (Bloom: Analyze); data (Bloom: Apply); work with ERP datasets (Bloom: Apply),Hard,"The ability to manage and automate data operations is increasingly vital as organizations rely more on data-driven decisions and seek to streamline processes through automation, even as routine data entry declines.",,,,,,
C1_b106,106,Develop and Design Web Applications,Create functional and user-centric web applications by applying design principles and development methodologies to meet specified requirements.,"[""craft web experiences"", ""develop web applications"", ""design web applications"", ""Design"", ""Develop""]",craft web experiences (Bloom: Apply); develop web applications (Bloom: Create); design web applications (Bloom: Create); Design (Bloom: Create); Develop (Bloom: Create),Hard,"While some legacy web development is declining, the core skills of designing and developing web applications remain crucial for creating interactive digital experiences across various platforms and emerging technologies.",,,,,,
C2_b107,107,Analyze and Monitor System Performance,"Analyze system performance and operational data to identify issues, propose improvements, and implement monitoring strategies for continuous optimization.","[""Analyse"", ""Monitoring"", ""Data"", ""use data""]",Analyse (Bloom: Apply); Monitoring (Bloom: Analyze); Data (Bloom: Apply); use data (Bloom: nan),Hard,"With the increasing complexity of software systems and the rise of data-driven decision-making, the ability to analyze performance and monitor systems is crucial for maintaining efficiency and proactively addressing challenges in evolving technological landscapes.",,,,,,
C2_b108,108,Create and Manage Project Budgets,Create and manage project budgets by allocating resources effectively and monitoring expenditures to ensure project financial viability and successful completion.,"[""budget"", ""build""]",budget (Bloom: Apply); build (Bloom: Create),Hard,Financial acumen and the ability to manage project budgets are increasingly important as software development projects become more complex and require strategic resource allocation to achieve business objectives.,,,,,,
