competency_id,batch_id,title,description,related_skills,related_skills_with_bloom,skill_focus,future_relevance,all_skills_human_verified,human_quality,human_relevant,human_skill_focus,human_notes,reviewer_id
C2_b1,1,Architect and Lead AI/GEN AI Solution Delivery,Architect and lead the delivery of AI and Generative AI solutions by planning enterprise AI software solutions and overseeing their implementation to meet strategic objectives.,"[""architecting AI /"", ""architect AI/GEN AI solutions"", ""lead delivery of AI solutions"", ""plan enterprise AI software solutions"", ""deliver enterprise AI software solutions""]",architecting AI / (Bloom: Create); architect AI/GEN AI solutions (Bloom: Create); lead delivery of AI solutions (Bloom: nan); plan enterprise AI software solutions (Bloom: nan); deliver enterprise AI software solutions (Bloom: Apply),Both,"As AI becomes more pervasive, the demand for professionals who can design and manage the entire lifecycle of complex AI systems, especially Generative AI, will continue to grow, ensuring successful integration and impact.",,,,,,
C1_b2,2,Design and Deploy Secure Cloud-Native Solutions,Design scalable and secure cloud environments by leveraging infrastructure as code principles and integrating CI/CD pipelines for continuous deployment on platforms like Azure.,"[""leverage Azure DevOps pipelines for CI/CD"", ""design cloud environments"", ""develop on Cloud platforms"", ""manage cloud"", ""supporting cloud (Azure)"", ""secure cloud environments"", ""use infrastructure as code""]",leverage Azure DevOps pipelines for CI/CD (Bloom: Apply); design cloud environments (Bloom: Create); develop on Cloud platforms (Bloom: Create); manage cloud (Bloom: Apply); supporting cloud (Azure) (Bloom: Evaluate); secure cloud environments (Bloom: Apply); use infrastructure as code (Bloom: Analyze),Hard,"Cloud computing is foundational for modern software development, and expertise in designing and securing cloud-native solutions is critical for future infrastructure and application deployment strategies. DevOps practices ensure efficient and reliable delivery.",,,,,,
C1_b3,3,Implement Secure Cloud Infrastructure and Services,"Implement secure and scalable cloud infrastructure and services by deploying infrastructure as code, managing cloud database platforms, and continuously deploying cloud services while adhering to cybersecurity best practices.","[""deploy infrastructure in code"", ""deploy cloud services continuously"", ""manage cloud database platforms"", ""implement cloud database platforms"", ""leverage Cloud middleware"", ""apply DevOps principles""]",deploy infrastructure in code (Bloom: Analyze); deploy cloud services continuously (Bloom: Apply); manage cloud database platforms (Bloom: Apply); implement cloud database platforms (Bloom: Apply); leverage Cloud middleware (Bloom: Apply); apply DevOps principles (Bloom: Apply),Hard,"Cloud computing is foundational for modern software development. This competency ensures professionals can build and maintain robust, secure, and efficient cloud environments, which is critical for digital transformation and innovation.",,,,,,
C8_b4,4,Information Security Reporting and Threat Alerting,Understand and report on information security incidents and alert stakeholders on potential threats to maintain a secure operational environment.,"[""report on information security"", ""alert on information security threats""]",report on information security (Bloom: Understand); alert on information security threats (Bloom: Apply),Hard,Proactive threat intelligence and clear communication are vital for organizational resilience. This competency ensures timely response to evolving cyber risks.,,,,,,
C1_b5,5,Develop and Deploy Scalable Cloud-Native Applications,"Create and deploy scalable, high-performance software solutions by leveraging cloud infrastructure, container orchestration (Kubernetes), and DevOps practices to ensure efficient and reliable operation.","[""innovate IT infrastructure"", ""champion DevOps practices"", ""work with Kubernetes at scale"", ""work with GCP"", ""develop software platforms""]",innovate IT infrastructure (Bloom: Create); champion DevOps practices (Bloom: nan); work with Kubernetes at scale (Bloom: Apply); work with GCP (Bloom: Apply); develop software platforms (Bloom: Create),Both,Cloud computing and containerization are foundational for modern software development. Proficiency in these areas is crucial for building resilient and adaptable systems that can meet evolving business demands and scale efficiently.,,,,,,
C1_b6,6,Develop and Deploy Cloud-Native Applications,Create and deploy containerized and decentralized applications within cloud environments by architecting scalable agent infrastructures and building robust CI/CD pipelines.,"[""deploy decentralized applications"", ""develop containerized applications"", ""architect scalable agent infrastructures"", ""execute global engineering initiatives"", ""maintain CI/CD pipelines"", ""build CI/CD pipelines""]",deploy decentralized applications (Bloom: Apply); develop containerized applications (Bloom: Create); architect scalable agent infrastructures (Bloom: Create); execute global engineering initiatives (Bloom: Create); maintain CI/CD pipelines (Bloom: Analyze); build CI/CD pipelines (Bloom: Create),Hard,"Cloud-native development is fundamental for scalable, resilient, and cost-effective software solutions, driving innovation across industries. Proficiency in this area ensures adaptability to evolving infrastructure demands.",,,,,,
C2_b7,7,Implement and Maintain Advanced Data Analytics Solutions,"Analyze and maintain real-time, high-performance data analytics solutions by transforming data with modern tools and developing innovative data solutions to extract actionable insights.","[""high -performance analytics"", ""maintain real-time analytics solutions"", ""innovative data solutions."", ""analyze data"", ""transform data with modern data transformation tools""]",high -performance analytics (Bloom: Apply); maintain real-time analytics solutions (Bloom: Analyze); innovative data solutions. (Bloom: Apply); analyze data (Bloom: Analyze); transform data with modern data transformation tools (Bloom: Apply),Hard,"Data-driven decision-making is increasingly vital across all industries. This competency prepares individuals to manage and leverage complex data, a skill in high demand for future roles in AI, business intelligence, and scientific research.",,,,,,
C8_b8,8,Design and Produce Interactive Game Experiences,Create engaging interactive game experiences by designing projects and making games that shape the future of gaming and entertainment.,"[""design projects"", ""shape the future of gaming"", ""make games""]",design projects (Bloom: Create); shape the future of gaming (Bloom: nan); make games (Bloom: Apply),Both,"The gaming industry continues to expand, driving demand for creative professionals who can design and develop immersive and innovative digital entertainment.",,,,,,
C9_b9,9,Apply Creative Problem-Solving in Technical Contexts,Apply creative thinking to solve complex technical challenges and achieve scheduling objectives.,"[""creative"", ""scheduling objectives.""]",creative (Bloom: Apply); scheduling objectives. (Bloom: Apply),Hard,"Beyond technical proficiency, creativity and effective planning are increasingly valued for innovating solutions and managing complex projects, especially in dynamic fields like AI development.",,,,,,
C6_b10,10,Manage and Optimize Database Infrastructure,"Analyze and manage database infrastructure to ensure optimal performance, reliability, and data integrity for various applications.","[""manage database infrastructure""]",manage database infrastructure (Bloom: Analyze),Hard,"Databases are the backbone of almost all software systems. Effective database management is crucial for data accessibility, security, and the overall performance of digital services.",,,,,,
C1_b11,11,Design and Deploy Cloud-Native Applications,Create and deploy scalable and resilient software applications within diverse cloud environments by leveraging microservices architectures and cloud-based infrastructure.,"[""create diverse environment"", ""deploy software"", ""deploy applications"", ""grow cloud-based recurring revenues"", ""develop SME section"", ""work with Microservices"", ""build equitable environment""]",create diverse environment (Bloom: nan); deploy software (Bloom: Apply); deploy applications (Bloom: Apply); grow cloud-based recurring revenues (Bloom: Apply); develop SME section (Bloom: Create); work with Microservices (Bloom: Apply); build equitable environment (Bloom: nan),Both,"Cloud computing is foundational for modern software development, enabling agility, scalability, and cost-efficiency. Proficiency in cloud-native development is crucial for future innovation and business growth.",,,,,,
C1_b12,12,Secure Software and Data Management,Create secure development practices for software components and data pipelines by applying principles of data protection and incident containment.,"[""contain data loss incidents"", ""demonstrate understanding of Data Protection Act"", ""delivering secure"", ""ensure secure development practices for vault mechanics"", ""ensure high-quality data pipelines""]",contain data loss incidents (Bloom: Apply); demonstrate understanding of Data Protection Act (Bloom: Evaluate); delivering secure (Bloom: Apply); ensure secure development practices for vault mechanics (Bloom: Create); ensure high-quality data pipelines (Bloom: Analyze),Hard,"With increasing cyber threats and data regulations, the ability to build and maintain secure systems is paramount. This competency directly addresses the growing need for robust cybersecurity measures in software and data management.",,,,,,
C1_b13,13,Develop and Deploy Cloud-Native Solutions,Create and deploy scalable and fault-tolerant software solutions in cloud environments by automating deployment processes and managing data pipelines.,"[""architect fault-tolerant agent infrastructures"", ""automate deployment"", ""deploy software in production settings"", ""launch new networks"", ""manage existing pipelines"", ""orchestrate solutions"", ""use GitHub"", ""work with Elastic Stack""]",architect fault-tolerant agent infrastructures (Bloom: Create); automate deployment (Bloom: Create); deploy software in production settings (Bloom: Apply); launch new networks (Bloom: Create); manage existing pipelines (Bloom: nan); orchestrate solutions (Bloom: nan); use GitHub (Bloom: Apply); work with Elastic Stack (Bloom: Apply),Both,"Cloud computing is fundamental to modern software infrastructure. Proficiency in deploying and managing cloud-native applications is crucial for scalability, reliability, and cost-efficiency in future IT landscapes.",,,,,,
C1_b14,14,Develop Secure and Scalable Cloud-Based Solutions,Create cloud-based recurring revenue models and strengthen data pipelines by ensuring compliance with 'Secure by Design' principles and supporting global standardization.,"[""create cloud-based recurring revenues"", ""strengthen pipelines"", ""support global standardization"", ""ensure compliance with Secure by Design""]",create cloud-based recurring revenues (Bloom: Create); strengthen pipelines (Bloom: Apply); support global standardization (Bloom: nan); ensure compliance with Secure by Design (Bloom: Create),Both,"Cloud computing remains a foundational technology, and the ability to build secure, scalable, and revenue-generating cloud solutions is critical for digital transformation and business growth. Security by Design is paramount in an increasingly interconnected world.",,,,,,
C9_b15,15,Validate Sustainability Data and Practices,"Evaluate and validate sustainability data to ensure accuracy and compliance, contributing to environmentally responsible technology development.","[""validate Sustainability data""]",validate Sustainability data (Bloom: Evaluate),Hard,Sustainability is a growing concern across all industries. The ability to validate and manage sustainability data will be crucial for companies to meet environmental goals and regulatory requirements.,,,,,,
C1_b16,16,Design and Architect Scalable Software Solutions,"Create scalable, high-performance software architectures by integrating engineering principles and ensuring efficient delivery of curated data within cloud environments.","[""produce engineering solutions"", ""architect systems"", ""architect software"", ""scalability are at the core of every solution."", ""Ensuring efficient delivery of TFSUKs curated data.""]",produce engineering solutions (Bloom: Create); architect systems (Bloom: Create); architect software (Bloom: Create); scalability are at the core of every solution. (Bloom: Apply); Ensuring efficient delivery of TFSUKs curated data. (Bloom: Evaluate),Hard,"This competency is crucial for developing robust and adaptable systems that can handle increasing demands, a core requirement in evolving digital landscapes and cloud-native applications.",,,,,,
C9_b17,17,Apply Coding Principles to Device Interaction,"Apply fundamental coding principles to establish and manage interactions with various devices, enabling the development of integrated hardware-software solutions.","[""link coding principles with devices""]",link coding principles with devices (Bloom: Apply),Hard,The proliferation of IoT and embedded systems means that understanding how software interacts with hardware is increasingly important. This competency is key for developing smart devices and interconnected systems.,,,,,,
C8_b18,18,Apply Technical Skills for Engineering Completion,Complete engineering tasks by applying technical skills and performing necessary joinery to meet project specifications.,"[""Completing engineer’s"", ""utilise technical skills"", ""perform joinery"", ""specify watercraft""]",Completing engineer’s (Bloom: Create); utilise technical skills (Bloom: Apply); perform joinery (Bloom: Apply); specify watercraft (Bloom: Apply),Hard,"Fundamental engineering and technical application skills remain the bedrock for physical and digital infrastructure development, ensuring the practical implementation of designs and solutions.",,,,,,
C9_b19,19,Content-Driven Growth Strategy Development,Analyze and transform content into a growth engine by applying strategic thinking to maximize its impact and reach.,"[""turn content into growth engine"", ""think outside the box on ways""]",turn content into growth engine (Bloom: nan); think outside the box on ways (Bloom: nan),Soft,"In the digital economy, content is a primary driver of engagement and business growth. This competency focuses on leveraging content strategically, a key skill for digital marketing and business development.",,,,,,
C1_b20,20,Collaborate and Communicate with Diverse Stakeholders,"Apply effective communication strategies to collaborate with technical and non-technical stakeholders, cross-functional teams, and engineering professionals to achieve project goals and foster positive working relationships.","[""Synthesize feedback from stakeholders into actionable systems"", ""advise stakeholders"", ""collaborate with cross-functional team"", ""collaborate with cross-functional teams"", ""collaborate with engineering professionals"", ""collaborate with internal departments"", ""communicate with non-technical stakeholders"", ""communicating with both technical"", ""develop respected relationships with diverse stakeholders"", ""foster internal relationships"", ""foster motivated teams"", ""non -technical stakeholders."", ""partner with cross-functional stakeholders"", ""thrive in a collaborative environment"", ""work in a collaborative environment"", ""work with cross-functional teams"", ""work with engineers""]",Synthesize feedback from stakeholders into actionable systems (Bloom: Create); advise stakeholders (Bloom: nan); collaborate with cross-functional team (Bloom: nan); collaborate with cross-functional teams (Bloom: nan); collaborate with engineering professionals (Bloom: nan); collaborate with internal departments (Bloom: nan); communicate with non-technical stakeholders (Bloom: nan); communicating with both technical (Bloom: Apply); develop respected relationships with diverse stakeholders (Bloom: nan); foster internal relationships (Bloom: nan); foster motivated teams (Bloom: nan); non -technical stakeholders. (Bloom: Apply); partner with cross-functional stakeholders (Bloom: nan); thrive in a collaborative environment (Bloom: nan); work in a collaborative environment (Bloom: nan); work with cross-functional teams (Bloom: nan); work with engineers (Bloom: nan),Both,"Effective collaboration and communication are increasingly vital in complex, interdisciplinary projects, especially with the rise of human-AI collaboration and distributed teams. This competency ensures smooth project execution and stakeholder alignment.",,,,,,
C1_b21,21,Design and Implement Scalable Digital Solutions,"Create innovative and technically feasible digital solutions, including real-time integrations and microservices, by applying design principles and leveraging appropriate technologies to deliver seamless user experiences.","[""apply technical knowledge"", ""create accessible services"", ""create experiences"", ""deliver seamless digital experiences"", ""deliver technically feasible solutions"", ""design innovative solutions"", ""design real-time integration with Salesforce"", ""develop scalable advertising solutions"", ""ensure integrated applications support business operations"", ""implementing REST based micro services"", ""lead the design direction""]",apply technical knowledge (Bloom: Apply); create accessible services (Bloom: Create); create experiences (Bloom: Create); deliver seamless digital experiences (Bloom: Apply); deliver technically feasible solutions (Bloom: Apply); design innovative solutions (Bloom: Create); design real-time integration with Salesforce (Bloom: Create); develop scalable advertising solutions (Bloom: Create); ensure integrated applications support business operations (Bloom: Create); implementing REST based micro services (Bloom: Apply); lead the design direction (Bloom: Create),Hard,"This competency is crucial for developing the next generation of digital products and services, especially with the increasing demand for integrated and high-performance systems in cloud environments.",,,,,,
C8_b22,22,Game Console Development and Storytelling,Apply game development principles to create engaging experiences for consoles by understanding platform specificities and integrating narrative elements to captivate players.,"[""consoles"", ""think in stories""]",consoles (Bloom: Apply); think in stories (Bloom: nan),Both,"The gaming industry continues to grow, demanding skilled developers who can create immersive experiences across various platforms. This competency combines technical console development with creative storytelling, essential for producing compelling interactive entertainment.",,,,,,
C8_b23,23,Human-Centric Innovation and Relationship Management,Experiment creatively and excel in relationship management by anticipating guest needs and fostering strong communication to drive human-centric innovation and collaboration.,"[""experiment creatively"", ""excel in relationship management"", ""anticipate guest needs"", ""communication skills"", ""audition""]",experiment creatively (Bloom: nan); excel in relationship management (Bloom: nan); anticipate guest needs (Bloom: nan); communication skills (Bloom: nan); audition (Bloom: nan),Soft,"In an increasingly automated world, human-centric skills like creativity, empathy, and strong relationship management become even more valuable for fostering innovation and successful human-AI collaboration.",,,,,,
C2_b24,24,Collaborate and Communicate as a Technical Specialist,"Provide guidance and share technical perspectives with stakeholders and cross-functional teams, fostering effective collaboration and managing relationships to achieve project goals.","[""stakeholder management abilities."", ""collaborate with stakeholders"", ""provide guidance in technical areas"", ""share perspective as a technical specialist"", ""leverage your technical skills"", ""develop tools"", ""collaborate with development teams"", ""own partnerships with cross-functional teams"", ""work collaboratively with business partners""]",stakeholder management abilities. (Bloom: Apply); collaborate with stakeholders (Bloom: nan); provide guidance in technical areas (Bloom: nan); share perspective as a technical specialist (Bloom: nan); leverage your technical skills (Bloom: Apply); develop tools (Bloom: nan); collaborate with development teams (Bloom: nan); own partnerships with cross-functional teams (Bloom: nan); work collaboratively with business partners (Bloom: nan),Both,"Effective communication and collaboration are increasingly vital in complex, interdisciplinary technical environments, enabling successful project delivery and innovation.",,,,,,
C2_b25,25,Database Management and Optimization for Hybrid Platforms,"Evaluate and optimize database processes, including supporting hybrid database platforms, to ensure efficient data management and system performance.","[""optimize database processes"", ""manage operations"", ""support hybrid database platforms"", ""organized administrator""]",optimize database processes (Bloom: Evaluate); manage operations (Bloom: nan); support hybrid database platforms (Bloom: Evaluate); organized administrator (Bloom: Analyze),Both,"As data volumes grow and cloud adoption increases, the ability to manage and optimize databases across hybrid environments is crucial for maintaining robust and scalable applications. This skill set is foundational for data-driven organizations.",,,,,,
C1_b26,26,Develop Scalable Cloud-Native Applications,Create scalable and high-performance software solutions by leveraging cloud infrastructure and ensuring seamless integration of commercial applications.,"[""build commercial applications"", ""Scale systems sustainably"", ""create scalable solutions"", ""ensuring seamless integration between commerce""]",build commercial applications (Bloom: Create); Scale systems sustainably (Bloom: Apply); create scalable solutions (Bloom: Create); ensuring seamless integration between commerce (Bloom: Apply),Hard,"The ability to develop scalable cloud-native applications is crucial as businesses increasingly migrate to cloud environments to handle growing data volumes and user demands, driving efficiency and innovation.",,,,,,
C8_b27,27,Engage with Government and Public Sector Collaborations,Apply collaborative strategies to work effectively with government sectors on technology initiatives.,"[""work collaboratively with government sectors""]",work collaboratively with government sectors (Bloom: nan),Soft,"As technology increasingly intersects with public services and policy, the ability to navigate and collaborate with government entities becomes valuable for large-scale projects and societal impact.",,,,,,
C2_b28,28,Analyze and Investigate Technical and Business Logic,Analyze and investigate complex technical and business logic by translating analytic questions into technical requirements to understand business processes and achieve organizational goals.,"[""translate analytic questions into technical requirements"", ""logic."", ""investigate"", ""understand business processes"", ""achieve goals""]",translate analytic questions into technical requirements (Bloom: Analyze); logic. (Bloom: Analyze); investigate (Bloom: Analyze); understand business processes (Bloom: nan); achieve goals (Bloom: nan),Both,"The ability to bridge the gap between business needs and technical solutions is increasingly vital. As AI and data-driven decision-making become more prevalent, understanding and analyzing underlying logic will be paramount.",,,,,,
C1_b29,29,Design and Develop Digital Content and Solutions,"Create engaging digital ad content, marketing campaigns, and technical solutions by applying design principles and leveraging various media formats to meet specific project requirements.","[""develop digital ad content"", ""develop marketing campaigns"", ""develop materials"", ""create technical solutions"", ""technical solutions."", ""media"", ""use of drawing""]",develop digital ad content (Bloom: Create); develop marketing campaigns (Bloom: Create); develop materials (Bloom: Create); create technical solutions (Bloom: Create); technical solutions. (Bloom: Apply); media (Bloom: Apply); use of drawing (Bloom: Apply),Hard,"The ability to design and develop compelling digital content is crucial for effective communication and engagement in an increasingly digital-first world, supporting marketing, education, and user experience across various industries.",,,,,,
