competency_id,batch_id,title,description,related_skills,related_skills_with_bloom,skill_focus,future_relevance,all_skills_human_verified,human_quality,human_relevant,human_skill_focus,human_notes,reviewer_id
C1_b30,30,Collaborative Software Development and Integration,"Create integrated software solutions by collaborating effectively with diverse technical and non-technical teams, utilizing APIs for system integration, and producing management information to support decision-making.","[""work closely with IT teams"", ""work closely with data teams"", ""collaborative"", ""integrate systems using APIs"", ""work closely with engineering teams"", ""technical"", ""partner with professionals"", ""produce management information""]",work closely with IT teams (Bloom: nan); work closely with data teams (Bloom: nan); collaborative (Bloom: Apply); integrate systems using APIs (Bloom: Create); work closely with engineering teams (Bloom: nan); technical (Bloom: Apply); partner with professionals (Bloom: nan); produce management information (Bloom: Create),Both,"Effective collaboration and seamless system integration are crucial for developing complex software in an increasingly interconnected digital landscape. This competency supports agile development and cross-functional teamwork, which are vital for future innovation.",,,,,,
C2_b31,31,Analyze and Visualize Data for Business Impact,Analyze sales trends and update Power BI reports to generate dashboards that drive measurable business impact.,"[""dashboards"", ""update Power BI reports"", ""interpret sales trends"", ""drive measurable business impact""]",dashboards (Bloom: Apply); update Power BI reports (Bloom: Understand); interpret sales trends (Bloom: Apply); drive measurable business impact (Bloom: nan),Both,Data-driven decision-making is paramount for future business success. This competency ensures individuals can translate raw data into actionable insights and communicate them effectively.,,,,,,
C6_b32,32,Evaluate and Enhance Technical and Process Quality,Evaluate QA processes and support technical excellence to ensure high-quality software delivery and continuous improvement in development methodologies.,"[""support QA processes"", ""elevate technical excellence."", ""support technical excellence.""]",support QA processes (Bloom: Evaluate); elevate technical excellence. (Bloom: Apply); support technical excellence. (Bloom: Evaluate),Hard,Quality assurance and continuous improvement are critical for maintaining competitive advantage and customer satisfaction in a rapidly evolving technological landscape. This ensures reliable and performant products.,,,,,,
C1_b33,33,Optimize System Performance and Efficiency,"Analyze existing systems and processes to implement efficiency improvement initiatives, maintain the ecosystem, and optimize business processes for enhanced performance and resource utilization.","[""implement efficiency improvement initiatives"", ""maintain existing ecosystem"", ""optimize business processes""]",implement efficiency improvement initiatives (Bloom: nan); maintain existing ecosystem (Bloom: Analyze); optimize business processes (Bloom: nan),Both,"As technology advances, the demand for efficient and sustainable systems grows. This competency ensures professionals can contribute to operational excellence and resource optimization, which are critical for business competitiveness and environmental responsibility.",,,,,,
C1_b34,34,Collaborate and Communicate Effectively in Software Development,"Collaborate effectively with diverse teams and stakeholders by sharing expertise, communicating complex issues clearly in writing, and balancing technical knowledge with leadership to achieve project goals.","[""work with company's IT team members"", ""collaborate with village teams"", ""balance technical expertise with leadership"", ""work closely with product teams"", ""engage with stakeholders"", ""share expertise within the team"", ""developing"", ""create technical documentation"", ""communicate complex issues in writing""]",work with company's IT team members (Bloom: nan); collaborate with village teams (Bloom: nan); balance technical expertise with leadership (Bloom: nan); work closely with product teams (Bloom: nan); engage with stakeholders (Bloom: nan); share expertise within the team (Bloom: nan); developing (Bloom: Create); create technical documentation (Bloom: Create); communicate complex issues in writing (Bloom: nan),Both,"Effective collaboration and communication are increasingly vital in agile development environments and distributed teams, ensuring successful project delivery and innovation in a rapidly evolving technological landscape.",,,,,,
C1_b35,35,Design and Implement Data Services and Workflows,"Create scalable data services and automate complex workflows by leading design initiatives, overseeing implementation, and integrating various systems and APIs.","[""lead design of data services"", ""oversee implementation of workflows"", ""manage post-production workflows"", ""oversee coordination of workflows"", ""APIs"", ""implement batch integration with Salesforce"", ""manage master data""]",lead design of data services (Bloom: Create); oversee implementation of workflows (Bloom: Apply); manage post-production workflows (Bloom: Apply); oversee coordination of workflows (Bloom: Apply); APIs (Bloom: Apply); implement batch integration with Salesforce (Bloom: Apply); manage master data (Bloom: Apply),Hard,"The ability to design and automate data-driven processes is crucial for efficiency and scalability in an increasingly data-centric world, supporting the growth of AI and analytics applications.",,,,,,
C1_b36,36,Design and Develop Event-Driven and AI-Powered Applications,"Create scalable and responsive event-driven applications, including GenAI solutions, by integrating technical possibilities and leveraging modern technologies and best practices.","[""develop event-driven applications"", ""design GenAI solutions"", ""integrate technical possibilities"", ""stay abreast of modern technologies and best practices"", ""develop""]",develop event-driven applications (Bloom: Create); design GenAI solutions (Bloom: Create); integrate technical possibilities (Bloom: nan); stay abreast of modern technologies and best practices (Bloom: nan); develop (Bloom: Create),Both,"Event-driven architectures are crucial for real-time systems and microservices, while GenAI solutions are at the forefront of AI innovation, driving future software capabilities and human-AI collaboration.",,,,,,
C2_b37,37,Lead and Administer Digital Platforms and Services,"Lead the administration and rollout of Human Capital Management (HCM) and data services, collaborating with other platform owners to shape platform capabilities and transform workflows effectively.","[""lead administration of HCM platform"", ""lead rollout of data services"", ""Works with other platforms owners"", ""shape platform capabilities"", ""transform workflows""]",lead administration of HCM platform (Bloom: Apply); lead rollout of data services (Bloom: Apply); Works with other platforms owners (Bloom: Apply); shape platform capabilities (Bloom: Apply); transform workflows (Bloom: Apply),Hard,"As organizations increasingly rely on digital platforms for core operations, leadership in platform administration and service rollout is vital. This ensures efficient management and continuous improvement of critical business systems.",,,,,,
C8_b38,38,Process Data Access Requests,Process Subject Access Requests by recalling relevant data protection regulations and procedures to ensure compliance with privacy standards.,"[""process Subject Access Requests""]",process Subject Access Requests (Bloom: Remember),Hard,"With increasing data privacy regulations (e.g., GDPR, CCPA), the ability to handle data access requests correctly is fundamental for legal compliance and maintaining customer trust.",,,,,,
C1_b39,39,Collaborate and Lead in Software Development Teams,"Lead projects and foster inclusion by collaborating with diverse stakeholders, including senior leadership and product designers, to build synergy and provide technical advice within an agile software development environment.","[""Lead"", ""Leadership"", ""Plan"", ""build synergy within the organization"", ""collaborate with architects"", ""collaborate with senior leadership"", ""collaboration."", ""demonstrate agility"", ""develop credible relationships with diverse stakeholders"", ""foster inclusion"", ""lead product designers"", ""lead projects"", ""provide technical advice"", ""work closely with teams"", ""work with product owners""]",Lead (Bloom: Apply); Leadership (Bloom: Apply); Plan (Bloom: Create); build synergy within the organization (Bloom: nan); collaborate with architects (Bloom: nan); collaborate with senior leadership (Bloom: nan); collaboration. (Bloom: Apply); demonstrate agility (Bloom: nan); develop credible relationships with diverse stakeholders (Bloom: nan); foster inclusion (Bloom: nan); lead product designers (Bloom: nan); lead projects (Bloom: nan); provide technical advice (Bloom: nan); work closely with teams (Bloom: nan); work with product owners (Bloom: nan),Both,"Effective collaboration and leadership are increasingly vital in complex, interdisciplinary software projects, especially with the rise of distributed teams and agile methodologies. Fostering inclusion ensures diverse perspectives contribute to innovation.",,,,,,
C1_b40,40,Lead and Collaborate in Software Development,"Lead teams in delivering quality software by effectively communicating ideas verbally, negotiating with stakeholders, and working collaboratively across multiple clients and cross-disciplined teams.","[""lead teams in delivering quality software"", ""communicate ideas verbally"", ""negotiate with stakeholders"", ""work across multiple clients"", ""work with cross-disciplined teams"", ""liaise with stakeholders"", ""work with subcontract professionals""]",lead teams in delivering quality software (Bloom: nan); communicate ideas verbally (Bloom: nan); negotiate with stakeholders (Bloom: nan); work across multiple clients (Bloom: nan); work with cross-disciplined teams (Bloom: nan); liaise with stakeholders (Bloom: nan); work with subcontract professionals (Bloom: nan),Soft,"Effective leadership and collaboration are increasingly vital in complex, distributed software development environments, fostering innovation and efficient project delivery. These skills are crucial for navigating diverse teams and stakeholder expectations in a globalized workforce.",,,,,,
C1_b41,41,Design and Implement Automated Testing Solutions,Create automated testing frameworks and scripts to ensure software quality and efficiency by performing automated testing and overseeing the implementation of digital models.,"[""perform automated testing"", ""oversee implementation of digital models""]",perform automated testing (Bloom: Create); oversee implementation of digital models (Bloom: Create),Hard,Automated testing is crucial for rapid development cycles and maintaining high-quality software in an increasingly complex technological landscape. This competency supports continuous integration and delivery practices.,,,,,,
C2_b42,42,Lead and Influence Technical and Design Initiatives,"Lead and influence technical and design direction by guiding junior staff, chairing technical steering committees, and developing global engineering initiatives to achieve technical excellence.","[""guide junior staff"", ""lead design direction"", ""develop global engineering initiatives"", ""lead technical steering committee meeting"", ""use local/global standards to support technical excellence"", ""influence technical direction"", ""guide design of services""]",guide junior staff (Bloom: nan); lead design direction (Bloom: nan); develop global engineering initiatives (Bloom: Create); lead technical steering committee meeting (Bloom: nan); use local/global standards to support technical excellence (Bloom: nan); influence technical direction (Bloom: nan); guide design of services (Bloom: nan),Both,"Leadership in technical and design domains is crucial for driving innovation, setting strategic direction, and ensuring the adoption of best practices in rapidly evolving technological landscapes.",,,,,,
C2_b43,43,Analyze and Transform Market Structures with Technology,"Analyze existing market structures and propose technological solutions to transform them, particularly within critical sectors like energy, by understanding complex interdependencies and forecasting impacts.","[""transform electricity market structure"", ""consult on SAP technology""]",transform electricity market structure (Bloom: Analyze); consult on SAP technology (Bloom: Analyze),Hard,"The rapid pace of technological change demands professionals who can not only understand but actively reshape markets, especially in areas like energy and digital transformation, to drive innovation and efficiency.",,,,,,
C1_b44,44,Develop and Implement Integrated ICT Solutions,Create integrated ICT solutions by combining various technologies and collaborating with stakeholders to deliver tailored outcomes that meet specific requirements.,"[""deliver tailored ICT solutions"", ""deliver integrated solutions"", ""contribute to engineering projects"", ""work with WiFi teams""]",deliver tailored ICT solutions (Bloom: Apply); deliver integrated solutions (Bloom: Create); contribute to engineering projects (Bloom: Create); work with WiFi teams (Bloom: nan),Both,The ability to integrate diverse technologies and collaborate effectively is crucial for developing complex systems and addressing multifaceted challenges in an increasingly interconnected digital landscape.,,,,,,
C9_b45,45,Adapt to Emerging Technologies and Tools,Apply and learn new tools and technologies to continuously enhance technical capabilities and adapt to evolving industry standards.,"[""new tools"", ""learn new tools""]",new tools (Bloom: Apply); learn new tools (Bloom: nan),Both,Technological landscapes are constantly shifting. The ability to quickly learn and apply new tools is a foundational skill for lifelong learning and staying relevant in any tech-driven career.,,,,,,
C1_b46,46,Collaborative Project Leadership and Delivery,"Lead and support the delivery of impactful projects by fostering professional networks, mentoring staff, sharing knowledge, and enhancing team effectiveness to achieve real value as a consultant.","[""network professionally"", ""mentor staff"", ""share knowledge within the team"", ""support delivery of projects"", ""deliver impactful projects"", ""manage Support Engineers"", ""deliver real value as a consultant"", ""work on real-world projects"", ""partner with communities"", ""maintain a shared work ethic"", ""enhance team effectiveness""]",network professionally (Bloom: nan); mentor staff (Bloom: nan); share knowledge within the team (Bloom: nan); support delivery of projects (Bloom: nan); deliver impactful projects (Bloom: nan); manage Support Engineers (Bloom: nan); deliver real value as a consultant (Bloom: nan); work on real-world projects (Bloom: nan); partner with communities (Bloom: nan); maintain a shared work ethic (Bloom: nan); enhance team effectiveness (Bloom: nan),Soft,"Effective collaboration and leadership are increasingly vital in complex, interdisciplinary projects. The ability to foster a productive team environment and deliver tangible value is a core future-proof skill.",,,,,,
C8_b47,47,Provide Technical Support and Financial Management,Evaluate technical issues to provide support for investigations and manage financial aspects related to technical operations.,"[""technical support for investigations"", ""provide financial management""]",technical support for investigations (Bloom: Evaluate); provide financial management (Bloom: nan),Both,The integration of technical and financial oversight is increasingly important for managing complex IT projects and ensuring resource optimization. This competency bridges technical expertise with business acumen.,,,,,,
C1_b48,48,Design and Architect Event-Driven Systems,Architect event-driven systems by applying principles of real-time integration and robust manufacturing process design to deliver scalable and responsive solutions.,"[""architect event-driven systems"", ""implement real-time integration with Salesforce"", ""ensure robust manufacturing process design""]",architect event-driven systems (Bloom: Create); implement real-time integration with Salesforce (Bloom: Apply); ensure robust manufacturing process design (Bloom: Create),Hard,"Event-driven architectures are crucial for building scalable, resilient, and real-time applications, which are increasingly important in modern distributed systems and microservices. This competency supports agile development and integration across diverse platforms.",,,,,,
C1_b49,49,Develop and Deploy Scalable Software Solutions,"Create and orchestrate scalable, high-performance software components and applications by structuring extensible data and application logic, ensuring they meet high standards of performance and operational requirements.","[""orchestrate transformation of vacant apartment homes"", ""ensure applications meet high standards of performance"", ""structure extensible data and application logic"", ""develop MuleSoft"", ""program with SQL""]",orchestrate transformation of vacant apartment homes (Bloom: Create); ensure applications meet high standards of performance (Bloom: Analyze); structure extensible data and application logic (Bloom: Analyze); develop MuleSoft (Bloom: Create); program with SQL (Bloom: Create),Hard,"The ability to develop and deploy scalable software is crucial for adapting to increasing data volumes and user demands, supporting cloud-native architectures and efficient resource utilization in future systems.",,,,,,
C9_b50,50,Provide Risk and Control Consulting,Provide consulting services on risks and controls to ensure robust governance and mitigate potential issues within projects and operations.,"[""provide consulting services on risks and controls""]",provide consulting services on risks and controls (Bloom: nan),Soft,"As technology advances, so do the associated risks. Expertise in identifying and mitigating risks and implementing controls is increasingly important for cybersecurity, data privacy, and regulatory compliance.",,,,,,
C8_b51,51,Create Engaging User Experiences,"Create immersive digital experiences, such as enabling travelers to enjoy an immersive ticket shopping experience, by integrating flexibility products and conducting performance reviews to optimize user interaction.","[""enable travelers to enjoy an immersive ticket shopping experience"", ""integrate flexibility products"", ""conduct performance reviews""]",enable travelers to enjoy an immersive ticket shopping experience (Bloom: Apply); integrate flexibility products (Bloom: Create); conduct performance reviews (Bloom: Evaluate),Hard,User experience (UX) is a primary differentiator in the digital economy. This competency is vital for designing intuitive and captivating interfaces that drive user engagement and satisfaction.,,,,,,
C2_b52,52,Evaluate and Optimize Data Service APIs,Evaluate the functionality and performance of data service APIs to ensure data quality standards are met and systems are installed correctly.,"[""test APIs for data services"", ""data quality standards"", ""ensure that all audio / visual systems are installed""]",test APIs for data services (Bloom: Evaluate); data quality standards (Bloom: Apply); ensure that all audio / visual systems are installed (Bloom: Analyze),Hard,"With the increasing reliance on data-driven applications, ensuring the quality and reliability of data services through rigorous API testing and adherence to data standards is paramount for maintaining system integrity and user trust.",,,,,,
C8_b53,53,Innovate and Adapt in Creative Environments,"Apply creative problem-solving to transform landscapes and thrive in dynamic, creative environments.","[""transform landscape"", ""thrive in a creative environment"", ""hands""]",transform landscape (Bloom: nan); thrive in a creative environment (Bloom: nan); hands (Bloom: Apply),Both,The ability to innovate and adapt within creative and rapidly changing environments is essential for industries like game development and other creative technology sectors.,,,,,,
C2_b54,54,Digital Product Leadership and Innovation,Lead the development of digital product capabilities by applying innovative approaches to shape opportunities into actionable plans and drive the creation of new features that delight users.,"[""lead digital product capability"", ""use innovative approaches"", ""lead new features"", ""shape opportunities into actionable plans"", ""delight users""]",lead digital product capability (Bloom: Apply); use innovative approaches (Bloom: nan); lead new features (Bloom: nan); shape opportunities into actionable plans (Bloom: nan); delight users (Bloom: nan),Both,The ability to lead and innovate in digital product development is essential for organizations to remain competitive and responsive to evolving market demands and user expectations.,,,,,,
C1_b55,55,Develop and Integrate Data-Driven Solutions,"Create and integrate data-driven solutions, such as Power Apps and Power BI reporting, by connecting with various data sources to deliver high-impact financial insights and support business decision-making.","[""integrate Power Apps with other data sources"", ""create insightful Power BI reporting"", ""deliver high-impact financial insights"", ""gain visibility into decision-making""]",integrate Power Apps with other data sources (Bloom: Create); create insightful Power BI reporting (Bloom: Create); deliver high-impact financial insights (Bloom: Apply); gain visibility into decision-making (Bloom: nan),Both,The ability to develop and integrate data-driven solutions is crucial as organizations increasingly rely on data for strategic decision-making and operational efficiency. This competency supports the growing demand for data literacy and analytical skills across industries.,,,,,,
C2_b56,56,Develop Accessible Digital Products,"Create digital products that are accessible to all users, including those with disabilities, by adhering to established accessibility standards and user-centered design principles.","[""create accessible products"", ""user""]",create accessible products (Bloom: Create); user (Bloom: Apply),Hard,"Ensuring digital accessibility is increasingly important for ethical design, broader market reach, and compliance with regulations in an inclusive digital society.",,,,,,
C9_b57,57,Adhere to Ethical and Problem-Solving Principles,Abide by ethical principles and apply structured thinking to solve complex problems.,"[""Abide"", ""think about a problem""]",Abide (Bloom: Apply); think about a problem (Bloom: nan),Both,"Ethical considerations are becoming increasingly important in technology, especially with AI and data privacy. Combining ethical adherence with strong problem-solving skills is essential for responsible innovation.",,,,,,
C2_b58,58,Implement Secure Development Practices for Smart Contracts,Ensure secure development practices for smart contract interactions by applying robust security principles and adhering to industry best practices.,"[""ensure secure development practices for smart contract interactions"", ""part numbers and""]",ensure secure development practices for smart contract interactions (Bloom: Create); part numbers and (Bloom: Apply),Hard,"With the rise of blockchain and decentralized applications, securing smart contracts is paramount to prevent vulnerabilities and financial losses. This competency addresses a critical need in emerging Web3 and blockchain technologies, which are experiencing strong growth.",,,,,,
C11_b59,59,Facilitate Organizational Change and Innovation,"Act as a change agent by contributing to educational content and creating a future for young people, driving innovation and positive transformation within an organization and community.","[""act as a change agent"", ""contribute to educational content"", ""create future for young people""]",act as a change agent (Bloom: nan); contribute to educational content (Bloom: nan); create future for young people (Bloom: nan),Soft,"In a constantly evolving world, individuals who can champion change, educate others, and inspire future generations are vital for organizational growth and societal progress.",,,,,,
C1_b60,60,Lead and Modernize Organizational Initiatives,"Lead and modernize organizational initiatives by coordinating design efforts, leveraging innovation, and ensuring the delivery of project production targets.","[""lead and"", ""modernize the organization"", ""coordinate design"", ""leverage innovation"", ""production targets."", ""ensure delivery of project""]",lead and (Bloom: Apply); modernize the organization (Bloom: Apply); coordinate design (Bloom: Create); leverage innovation (Bloom: Apply); production targets. (Bloom: Apply); ensure delivery of project (Bloom: nan),Both,"This competency is crucial for driving organizational change and adapting to new technologies and market demands, which are constant in the evolving digital landscape. Effective leadership and modernization are key to sustained growth and competitiveness.",,,,,,
